{
  "deploymentGate": {
    "blockingThreshold": null,
    "budgetRemainingPercent": null,
    "message": null,
    "recommendations": [],
    "status": "APPROVED",
    "warningThreshold": 20.0
  },
  "errorBudget": {
    "burnRate": null,
    "consumedMinutes": null,
    "remainingMinutes": null,
    "remainingPercent": null,
    "status": null,
    "totalMinutes": null
  },
  "generatedAt": "<masked>",
  "links": {
    "alertsYaml": "generated/notification-service/alerts.yaml",
    "grafanaDashboard": null,
    "runbook": null,
    "serviceManifest": "examples/services/notification-service.yaml",
    "slothSpec": "generated/notification-service/sloth/notification-service.yaml"
  },
  "schemaVersion": "v1",
  "score": {
    "band": null,
    "components": {
      "deploySuccessRate": null,
      "errorBudgetRemaining": null,
      "incidentScore": null,
      "sloCompliance": null
    },
    "grade": null,
    "score": null,
    "trend": null
  },
  "service": {
    "description": null,
    "name": "notification-service",
    "supportModel": "self",
    "team": "platform",
    "tier": "standard",
    "type": "worker"
  },
  "slos": [
    {
      "currentValue": null,
      "description": null,
      "name": "job-success-rate",
      "sloType": "availability",
      "status": null,
      "target": 99.5,
      "window": "30d"
    },
    {
      "currentValue": null,
      "description": null,
      "name": "processing-time-p95",
      "sloType": "latency",
      "status": null,
      "target": 95.0,
      "window": "30d"
    }
  ]
}
