{
  "deploymentGate": {
    "blockingThreshold": 10.0,
    "budgetRemainingPercent": null,
    "message": null,
    "recommendations": [],
    "status": "APPROVED",
    "warningThreshold": 20.0
  },
  "errorBudget": {
    "burnRate": null,
    "consumedMinutes": null,
    "remainingMinutes": null,
    "remainingPercent": null,
    "status": null,
    "totalMinutes": null
  },
  "generatedAt": "<masked>",
  "links": {
    "alertsYaml": "generated/triage-agent/alerts.yaml",
    "grafanaDashboard": null,
    "runbook": null,
    "serviceManifest": "<opensrm>/spec/v2/examples/judgment-thresholds/single-bounds.yaml",
    "slothSpec": "generated/triage-agent/sloth/triage-agent.yaml"
  },
  "schemaVersion": "v1",
  "score": {
    "band": null,
    "components": {
      "deploySuccessRate": null,
      "errorBudgetRemaining": null,
      "incidentScore": null,
      "sloCompliance": null
    },
    "grade": null,
    "score": null,
    "trend": null
  },
  "service": {
    "description": null,
    "name": "triage-agent",
    "supportModel": "self",
    "team": "risk",
    "tier": "critical",
    "type": "ai-gate"
  },
  "slos": []
}
